{
  "uuid":"uuid",
  "version": "0.1",
  "name": "Select lower slice / Select lower slice of Medulla Oblongata",
  "description": "Task to annotate three images",
  "owner":"gregory.bliault@u-bordeaux.fr",
  "privacy":"PUBLIC",
  "creationDate":"",
  "process": {
    "type":"manual",
    "execution" : {
      "executor":"SPINE",
      "descriptorId":"uuid"
    },
    "contributionType": "SINGLE_USER"
  },
  "constants": {
  },
  "inputs": {
    "images" : {
      "name": "Images",
      "description": "List of image to be annotated",
      "type": "imageEntityInOut",
      "filter":{},
      "imageEntityInOut_FileFormat":"nii",
      "isList": true,
      "imageEntityInOut_Type":"ANATOMICAL"
    }
  },
  "outputs": {
    "roi" : {
      "name": "Created ROIs",
      "description": "List of annotations",
      "type": "roiInOut",
      "isList": true,
      "roiInOut_FileFormat": "json",
      "schema": "https://raw.githubusercontent.com/SPINEProject/SPINE-json-schema/master/schemas/roi.schema.json",
      "metadata":{},
      "reference":{}
    }
  }
}
